Name,Is featured?,Short description,In stock?,Low stock amount,Sold individually?,Weight (kg),Allow customer reviews?,Sale price,Regular price,Categories,Images
Harina La Rosa De Trigo Para Baleada 454 Gr ,0,Harina La Rosa De Trigo Para Baleada 454 Gr ,1,3,1,2,1,8.90,8.903.3,Despensa > harinas,https://ik.imagekit.io/wlqrwe5vf6p/harinas/Harina_La_Rosa_De_Trigo_Para_Baleada_454_Gr__SEahHWdpa.png
Harina Pan De Maíz Blanco 2 Lb ,0,Harina Pan De Maíz Blanco 2 Lb ,1,3,1,2,1,65.52,65.523.3,Despensa > harinas,https://ik.imagekit.io/wlqrwe5vf6p/harinas/Harina_Pan_De_Ma_z_Blanco_2_Lb__v8stNLJdH.png
Harina Gold De Trigo 80 Oz ,0,Harina Gold De Trigo 80 Oz ,1,3,1,2,1,56.90,56.903.3,Despensa > harinas,https://ik.imagekit.io/wlqrwe5vf6p/harinas/Harina_Gold_De_Trigo_80_Oz__0Ns201gYP.png
Harina El Panadero De Trigo 5 Lb ,0,Harina El Panadero De Trigo 5 Lb ,1,3,1,2,1,41.56,41.563.3,Despensa > harinas,https://ik.imagekit.io/wlqrwe5vf6p/harinas/Harina_El_Panadero_De_Trigo_5_Lb__cqGkrLciP.png
Harina Maseca De Maíz Con Hierro 3 Lb ,0,Harina Maseca De Maíz Con Hierro 3 Lb ,1,3,1,2,1,26.90,26.903.3,Despensa > harinas,https://ik.imagekit.io/wlqrwe5vf6p/harinas/Harina_Maseca_De_Ma_z_Con_Hierro_3_Lb__6vJPZ6brk.png
Harina Maseca De Maíz Amarillo 2 Lb ,0,Harina Maseca De Maíz Amarillo 2 Lb ,1,3,1,2,1,17.90,17.903.3,Despensa > harinas,https://ik.imagekit.io/wlqrwe5vf6p/harinas/Harina_Maseca_De_Ma_z_Amarillo_2_Lb__yxUmzq4QV.png
Harina Maseca De Maíz Saco 25 Lb ,0,Harina Maseca De Maíz Saco 25 Lb ,1,3,1,2,1,215.90,215.903.3,Despensa > harinas,https://ik.imagekit.io/wlqrwe5vf6p/harinas/Harina_Maseca_De_Ma_z_Saco_25_Lb__Mm6IQKJZE.png
Harina Del Comal De Maíz 2 Lb ,0,Harina Del Comal De Maíz 2 Lb ,1,3,1,2,1,15.21,15.213.3,Despensa > harinas,https://ik.imagekit.io/wlqrwe5vf6p/harinas/Harina_Del_Comal_De_Ma_z_2_Lb__108I2vnYWu.png
Harina Maseca De Maíz 5 Lb ,0,Harina Maseca De Maíz 5 Lb ,1,3,1,2,1,46.90,46.903.3,Despensa > harinas,https://ik.imagekit.io/wlqrwe5vf6p/harinas/Harina_Maseca_De_Ma_z_5_Lb__d1wdkm5Hf.png
Harina Gold Star De Trigo Especial Para Baleadas 5 Lb ,0,Harina Gold Star De Trigo Especial Para Baleadas 5 Lb ,1,3,1,2,1,43.90,43.903.3,Despensa > harinas,https://ik.imagekit.io/wlqrwe5vf6p/harinas/Harina_Gold_Star_De_Trigo_Especial_Para_Baleadas_5_Lb__ERVgitZi7.png
Mezcla Lista Maseca Para Pastelitos 454 Gr ,0,Mezcla Lista Maseca Para Pastelitos 454 Gr ,1,3,1,2,1,12.90,12.903.3,Despensa > harinas,https://ik.imagekit.io/wlqrwe5vf6p/harinas/Mezcla_Lista_Maseca_Para_Pastelitos_454_Gr__fjpTrjVQq.png
Harina De Trigo Gold Star Fortificada Sab/Mantequilla 434 Gr ,0,Harina De Trigo Gold Star Fortificada Sab/Mantequilla 434 Gr ,1,3,1,2,1,11.90,11.903.3,Despensa > harinas,https://ik.imagekit.io/wlqrwe5vf6p/harinas/Harina_De_Trigo_Gold_Star_Fortificada_Sab_Mantequilla_434_Gr__2wef_9s-ov.png
