Name,Is featured?,Short description,In stock?,Low stock amount,Sold individually?,Weight (kg),Allow customer reviews?,Sale price,Regular price,Categories,Images
Aceite Vegetal Ideal De Girasol Y Soya 1000 Ml ,0,Aceite Vegetal Ideal De Girasol Y Soya 1000 Ml ,1,3,1,2,1,57.90,57.903.3,Despensa > aceites-y-mantecas,https://ik.imagekit.io/wlqrwe5vf6p/aceites-y-mantecas/Aceite_Vegetal_Ideal_De_Girasol_Y_Soya_1000_Ml___UBHGH_1p.png
Aceite De Canola Wesson 1.25 Gl ,0,Aceite De Canola Wesson 1.25 Gl ,1,3,1,2,1,369.90,369.903.3,Despensa > aceites-y-mantecas,https://ik.imagekit.io/wlqrwe5vf6p/aceites-y-mantecas/Aceite_De_Canola_Wesson_1.25_Gl__YSIHIj6wBd.png
Aceite Vegetal Ahorro Max 443 Ml ,0,Aceite Vegetal Ahorro Max 443 Ml ,1,3,1,2,1,23.90,23.903.3,Despensa > aceites-y-mantecas,https://ik.imagekit.io/wlqrwe5vf6p/aceites-y-mantecas/Aceite_Vegetal_Ahorro_Max_443_Ml__5sNCmrp8Wn.png
Aceite De Oliva Olitalia Extra Virgen 500 Ml ,0,Aceite De Oliva Olitalia Extra Virgen 500 Ml ,1,3,1,2,1,235.90,235.903.3,Despensa > aceites-y-mantecas,https://ik.imagekit.io/wlqrwe5vf6p/aceites-y-mantecas/Aceite_De_Oliva_Olitalia_Extra_Virgen_500_Ml__Xs2NaSVAf.png
Manteca Ahorro Max 1 Kg ,0,Manteca Ahorro Max 1 Kg ,1,3,1,2,1,29.90,29.903.3,Despensa > aceites-y-mantecas,https://ik.imagekit.io/wlqrwe5vf6p/aceites-y-mantecas/Manteca_Ahorro_Max_1_Kg__NKz9FcanDq.png
Aceite De Vegetal Ahorro Max 750 Ml ,0,Aceite De Vegetal Ahorro Max 750 Ml ,1,3,1,2,1,47.90,47.903.3,Despensa > aceites-y-mantecas,https://ik.imagekit.io/wlqrwe5vf6p/aceites-y-mantecas/Aceite_De_Vegetal_Ahorro_Max_750_Ml__dbPaDkS-c1.png
Aceite De Oliva Carbonell Clásico 500 Ml ,0,Aceite De Oliva Carbonell Clásico 500 Ml ,1,3,1,2,1,210.90,210.903.3,Despensa > aceites-y-mantecas,https://ik.imagekit.io/wlqrwe5vf6p/aceites-y-mantecas/Aceite_De_Oliva_Carbonell_Cl_sico_500_Ml__v0ViRCCk4.png
Aceite De Canola Mazola 946 Ml ,0,Aceite De Canola Mazola 946 Ml ,1,3,1,2,1,89.90,89.903.3,Despensa > aceites-y-mantecas,https://ik.imagekit.io/wlqrwe5vf6p/aceites-y-mantecas/Aceite_De_Canola_Mazola_946_Ml__dUxFhbF-4S.png
Aceite Essential Everyday Buttery En Spray 6 Oz ,0,Aceite Essential Everyday Buttery En Spray 6 Oz ,1,3,1,2,1,69.90,69.903.3,Despensa > aceites-y-mantecas,https://ik.imagekit.io/wlqrwe5vf6p/aceites-y-mantecas/Aceite_Essential_Everyday_Buttery_En_Spray_6_Oz__TcCFGgPmP.png
Aceite Essential Everyday Mezclado Canola Y Vegetal 48 Oz ,0,Aceite Essential Everyday Mezclado Canola Y Vegetal 48 Oz ,1,3,1,2,1,119.90,119.903.3,Despensa > aceites-y-mantecas,https://ik.imagekit.io/wlqrwe5vf6p/aceites-y-mantecas/Aceite_Essential_Everyday_Mezclado_Canola_Y_Vegetal_48_Oz__htkw9OijIn.png
Aceite Wesson Vegetal 1 Gl ,0,Aceite Wesson Vegetal 1 Gl ,1,3,1,2,1,341.90,341.903.3,Despensa > aceites-y-mantecas,https://ik.imagekit.io/wlqrwe5vf6p/aceites-y-mantecas/Aceite_Wesson_Vegetal_1_Gl__t2y5zUGNw7.png
Aceite Essential Everyday Maíz 1 Gl ,0,Aceite Essential Everyday Maíz 1 Gl ,1,3,1,2,1,309.90,309.903.3,Despensa > aceites-y-mantecas,https://ik.imagekit.io/wlqrwe5vf6p/aceites-y-mantecas/Aceite_Essential_Everyday_Ma_z_1_Gl__jxwcX3laD.png
Aceite Essential Everyday Canola 48 Oz ,0,Aceite Essential Everyday Canola 48 Oz ,1,3,1,2,1,119.90,119.903.3,Despensa > aceites-y-mantecas,https://ik.imagekit.io/wlqrwe5vf6p/aceites-y-mantecas/Aceite_Essential_Everyday_Canola_48_Oz__5mOsBiXoFQ.png
Aceite Essential Everyday Vegetal 32 Oz ,0,Aceite Essential Everyday Vegetal 32 Oz ,1,3,1,2,1,79.90,79.903.3,Despensa > aceites-y-mantecas,https://ik.imagekit.io/wlqrwe5vf6p/aceites-y-mantecas/Aceite_Essential_Everyday_Vegetal_32_Oz__ZIBuiDCX9u.png
Aceite De Oliva Essential Everyday Puro 17 Oz ,0,Aceite De Oliva Essential Everyday Puro 17 Oz ,1,3,1,2,1,169.90,169.903.3,Despensa > aceites-y-mantecas,https://ik.imagekit.io/wlqrwe5vf6p/aceites-y-mantecas/Aceite_De_Oliva_Essential_Everyday_Puro_17_Oz__nA0cx8u6q.png
Aceite De Oliva Essential Everyday Extra Virgen 17 Oz ,0,Aceite De Oliva Essential Everyday Extra Virgen 17 Oz ,1,3,1,2,1,169.90,169.903.3,Despensa > aceites-y-mantecas,https://ik.imagekit.io/wlqrwe5vf6p/aceites-y-mantecas/Aceite_De_Oliva_Essential_Everyday_Extra_Virgen_17_Oz__XrHowM29ac.png
